matchedPattern,context,lineNumber,columnNumber,publicationName
PS51257,"... pattern, and residues D17 to D21 (CITAC) hit the PS51257 pattern (Figure 3A) [27], which suggested ...",32,420,BMC_Microbiol_2010_Dec_1_10_309.txt
PS51257,"...n, and amino acid residues D17 to D21 (CITAC) hit PS51257 pattern. The symbol \"<\" indicates that the...",34,310,BMC_Microbiol_2010_Dec_1_10_309.txt
PS51257,...mbrane lipoprotein lipid attachment site motif is PS51257,286,142,PLoS_Genet_2007_May_18_3(5)_e75.txt
PS51257,...SE: PS50059; PPIC_PPIASE: PS01096; PROKAR_LIPOPR: PS51257; TPR: PS50005; FHA: PS50006. Sequences fla...,101,254,PLoS_Negl_Trop_Dis_2010_Jun_29_4(6)_e729.txt
PS51257,...cted at the N-terminus (http://prosite.expasy.org/PS51257) that suggest potential attachment to the ...,13,946,PMC5311943.txt
PS51257,"...sylation site, PS00009: AMIDATION Amidation site, PS51257: PROKAR_LIPOPROTEIN Prokaryotic membrane l...",244,796,Springerplus_2012_Oct_5_1_30.txt
